<?xml version="1.0" encoding="utf-8" ?>
<OperationsResearch xmlns:xsi="http://www.w3.org/2001/XMLSchema-instance" xsi:schemaLocation="http://www.fom.de/schemas/operations-research/ws-11 Simplex-v1.0.xsd">
   <!-- x1, x2, s1, s2, s3, s4, g(0), <Empty> -->
   <!-- I, II, III, IV, Zielfunktion -->
   <Simplex>
      <Tableaux>
         <Tableau index="0">
            <Columns>
               <Column index="0">x1</Column>
               <Column index="1">x1</Column>
               <Column index="2">x1</Column>
               <Column index="3">x1</Column>
               <Column index="4">x1</Column>
               <Column index="5">x1</Column>
               <Column index="6">x1</Column>
               <Column index="7">x1</Column>
            </Columns>
            <Elements>
               <Element m="0" n="0">1</Element>
               <Element m="0" n="1">0</Element>
               <Element m="0" n="2">1</Element>
               <Element m="0" n="3">0</Element>
               <Element m="0" n="4">0</Element>
               <Element m="0" n="5">0</Element>
               <Element m="0" n="6">0</Element>
               <Element m="0" n="7">12</Element>

               <Element m="1" n="0">0</Element>
               <Element m="1" n="1">1</Element>
               <Element m="1" n="2">0</Element>
               <Element m="1" n="3">1</Element>
               <Element m="1" n="4">0</Element>
               <Element m="1" n="5">0</Element>
               <Element m="1" n="6">0</Element>
               <Element m="1" n="7">15</Element>

               <Element m="2" n="0">1</Element>
               <Element m="2" n="1">3</Element>
               <Element m="2" n="2">0</Element>
               <Element m="2" n="3">0</Element>
               <Element m="2" n="4">1</Element>
               <Element m="2" n="5">0</Element>
               <Element m="2" n="6">0</Element>
               <Element m="2" n="7">51</Element>

               <Element m="3" n="0">3</Element>
               <Element m="3" n="1">1</Element>
               <Element m="3" n="2">0</Element>
               <Element m="3" n="3">0</Element>
               <Element m="3" n="4">0</Element>
               <Element m="3" n="5">1</Element>
               <Element m="3" n="6">0</Element>
               <Element m="3" n="7">41</Element>

               <Element m="4" n="0">-9</Element>
               <Element m="4" n="1">-3</Element>
               <Element m="4" n="2">0</Element>
               <Element m="4" n="3">0</Element>
               <Element m="4" n="4">0</Element>
               <Element m="4" n="5">0</Element>
               <Element m="4" n="6">1</Element>
               <Element m="4" n="7">0</Element>
            </Elements>
            <Solution>
               <Element n="0">0</Element>
               <Element n="1">0</Element>
               <Element n="2">12</Element>
               <Element n="3">15</Element>
               <Element n="4">51</Element>
               <Element n="5">41</Element>
               <Element n="7">0</Element>
            </Solution>
         </Tableau>
      </Tableaux>
      <Transformations>
         <Transformation tableau="0">
            <Solution>
               <Element n="0">0</Element>
               <Element n="1">0</Element>
               <Element n="2">12</Element>
               <Element n="3">15</Element>
               <Element n="4">51</Element>
               <Element n="5">41</Element>
               <Element n="7">0</Element>
            </Solution>
         </Transformation>
      </Transformations>
   </Simplex>

   <Tableau index="">
      <RowTransformations>
         <RowTransformation index="0"></RowTransformation>
      </RowTransformations>
      <Rows>
         <Row index="">

         </Row>
      </Rows>
   </Tableau>
</OperationsResearch>
